{"bundle_id":"research-fixture-20260911","delivery_state":"validated","generated_at_utc":"2026-09-11T19:22:24.301450+00:00","last_run_utc":"2026-09-11T19:22:24.301450+00:00","next_recommended_run_utc":"2026-09-12T19:22:24.301450+00:00","observation_time_utc":null,"schema_version":"daily-ingest-status.v2","source_bundle_id":"source-fixture-20260911","sources":[{"file":"rtsw_mag_1m.json","observation_time_utc":null,"ok":true,"origin":"fixture","retrieved_at_utc":null,"source":"NOAA/SWPC committed fixture"},{"file":"rtsw_wind_1m.json","observation_time_utc":null,"ok":true,"origin":"fixture","retrieved_at_utc":null,"source":"NOAA/SWPC committed fixture"}],"status":"degraded","warnings":["Local generation and validation are not approval, merge, deployment or served verification.","Research/learning only; no operational forecasting."]}
